category,title,creator,publication_year,description
movie,Split Select,Kelli Stroman,1924,Alias quaerat illo nemo.
album,Dark Mug,Alleen Lebsack DO,1979,Suscipit et molestiae mollitia.
book,Heart Equinox,Mr. Nga Kunde,1940,Rerum possimus necessitatibus non.
book,Strong Java,Matthew Ebert,1958,Ut animi nam hic.
book,Holiday Symphony,Refugio Conroy,1991,Praesentium eligendi deserunt numquam.
album,Goodbye Mug,Federico Boyer,1995,Temporibus cumque nam harum.
book,Captain's Utopia,Philip Cole,1985,Et vitae pariatur delectus.
movie,Kreb-Full-o Town,Carroll Zemlak,1972,Sit blanditiis autem mollitia.
movie,Winter Volcano,Rheba Schroeder,1967,Sunt omnis ut et.
album,Captain's Level,Edison Gerhold Sr.,1938,Debitis voluptatem quidem itaque.
book,Cascara Been,Bryant Brown,1962,Enim consequatur rerum incidunt.
album,Wake-up Cowboy,Miss Edwin Ledner,1949,Excepturi officiis consequuntur est.
movie,Holiday Volcano,Wilbur MacGyver,1956,Doloribus neque et veritatis.
book,Winter Equinox,Polly Raynor,1967,Enim quae ea est.
movie,Thanksgiving Look,Audie Goyette I,1989,Consectetur hic distinctio architecto.
book,Major ,Ms. Armand Ortiz,2016,Enim sed et animi.
album,Winter Delight,Kenda Gorczany,1938,Tenetur perspiciatis qui reprehenderit.
album,Summer Breaker,Clarence Leuschke,1965,Nemo reiciendis quod tempore.
movie,Morning Bean,Ernesto Mueller,1955,Hic recusandae reiciendis amet.
movie,Winter Mug,Etta Walter,1942,Hic laborum soluta et.
book,Green Star,Antione O'Connell,2003,Odit omnis neque aut.
album,Major Light,Glen Rau,1994,Id fugit et natus.
album,Evening Extract,Mandy Abbott,1970,Velit minus eius quas.
movie,Express Pie,Prof. Nichelle Corwin,1923,Expedita et deleniti aut.
album,Green Cowboy,Carter McCullough,2002,Aut esse a eum.
